{
  "$schema": "hooks/antigravity-contract.schema.json",
  "schemaVersion": "1.0.0",
  "runtime": "antigravity",
  "minimumCliVersion": "1.0.0",
  "phases": {
    "discovery": {
      "rules": ".agents/rules",
      "skills": ".agents/skills",
      "workflows": ".agents/workflows"
    },
    "mcp": {
      "workspaceConfig": ".agents/mcp_config.json",
      "suiteGlobalConfig": "~/.gemini/config/mcp_config.json",
      "cliGlobalConfig": "~/.gemini/antigravity-cli/mcp_config.json"
    },
    "hooks": {
      "config": ".agents/hooks.json",
      "policy": ".agents/hooks/validate-tool-call.mjs"
    },
    "orchestration": {
      "workflows": ["coordinate", "orchestrate"],
      "agents": ["orchestrator", "project-planner", "security-auditor", "test-engineer"],
      "skills": ["coordinator-mode", "parallel-agents", "intelligent-routing", "verify-changes"]
    },
    "plugin": {
      "builder": ".agents/hooks/build-plugin.mjs",
      "defaultOutput": "dist/antigravity-plugin"
    },
    "validation": {
      "doctor": ".agents/hooks/antigravity-doctor.mjs",
      "tests": ".agents/hooks/tests"
    }
  }
}
